{
  "$schema": "https://json-schema.org/draft/2020-12/schema",
  "$id": "https://picasso.dev/schema/profile-provenance/1.0.0",
  "title": "Profile Provenance",
  "description": "능력 프로파일의 각 값이 **어디서 왔는가**. §15.7이 방어책으로 든 것은 *\"프로파일을 벤더 문서에서 파생시키고 괴리가 발견되면 고친다\"* 하나였고, 그것은 규율이지 검사가 아니었다 — 지키지 않아도 아무 데도 빨간불이 안 들어온다. 이 문서가 그 규율을 **대조 가능한 형태**로 만든다. 키가 `vendor-survey.schema.json`의 `coverage`와 **일대일**인 것이 요점이다: 조사가 '벤더가 이것을 주지 않는다'고 적은 항목을 프로파일이 '로봇이 말했다'고 주장하면 시험이 그것을 잡는다. **채우는 것을 막지 않는다** — 어댑터가 값을 정하는 것은 정당하고 불가피하다(§9.7). 막는 것은 어댑터가 정한 값이 로봇의 선언인 척하는 것이다.",
  "type": "object",
  "additionalProperties": false,
  "required": ["schema_version", "profile", "survey", "coverage"],
  "properties": {
    "schema_version": { "type": "string", "const": "1.0.0" },
    "profile": {
      "description": "`profile/profiles/` 안의 대상 프로파일 파일명.",
      "type": "string",
      "minLength": 1
    },
    "survey": {
      "description": "`profile/vendors/` 안의 조사 문서 파일명. 프로파일과 조사의 `vendor`·`model` 좌표는 다를 수 있다 — 조사는 사람이 읽는 표기(`Unitree`/`G1`)이고 프로파일의 좌표는 게이트 7번의 탐색어 제약(8자 이상, 구분 기호 포함)을 받는다. 그래서 이름으로 짐작하지 않고 여기에 적는다.",
      "type": "string",
      "minLength": 1
    },
    "coverage": {
      "description": "조사의 `coverage`와 같은 일곱 항목. 하나라도 빠지면 시험이 실패한다 — 빠진 항목은 출처가 없는 값이고, 출처가 없는 값이야말로 이 문서가 겨냥하는 것이다.",
      "type": "object",
      "additionalProperties": false,
      "required": [
        "model_identity",
        "supported_skills",
        "cancel_pause",
        "parameter_ranges",
        "protocol_limits",
        "failure_modes",
        "publish_interval"
      ],
      "properties": {
        "model_identity": { "$ref": "#/$defs/origin" },
        "supported_skills": { "$ref": "#/$defs/origin" },
        "cancel_pause": { "$ref": "#/$defs/origin" },
        "parameter_ranges": { "$ref": "#/$defs/origin" },
        "protocol_limits": { "$ref": "#/$defs/origin" },
        "failure_modes": { "$ref": "#/$defs/origin" },
        "publish_interval": { "$ref": "#/$defs/origin" }
      }
    },
    "notes": {
      "description": "조사의 일곱 항목이 담지 못하는 파생 사실. 자유 서술이며 시험은 비어 있지 않은지만 본다.",
      "type": "array",
      "items": { "type": "string", "minLength": 1 }
    }
  },
  "$defs": {
    "origin": {
      "type": "object",
      "additionalProperties": false,
      "required": ["origin", "note"],
      "properties": {
        "origin": {
          "description": "ROBOT = 기체가 런타임에 이 값을 보고하고 우리가 그것을 읽는다. VENDOR_DOC = 벤더 문서·SDK 소스에 선언돼 있고 우리가 옮겨 적었다. ADAPTER = 벤더에게 근거가 없고 **어댑터가 정한 값**이다. ABSENT = 프로파일이 이 항목에 아무것도 선언하지 않았고 그것이 의도다.",
          "enum": ["ROBOT", "VENDOR_DOC", "ADAPTER", "ABSENT"]
        },
        "note": {
          "description": "**근거를 함께 적는다.** `ADAPTER`라면 왜 어댑터가 정해야 했는지, `ABSENT`라면 왜 비웠는지. 판정만 남기면 조사인지 짐작인지 나중에 구분되지 않는다(조사 문서와 같은 규율).",
          "type": "string",
          "minLength": 1
        }
      }
    }
  }
}
